id,subtitles,Funny,Beautiful,Ingenious,Courageous,Longwinded,Confusing,Informative,Fascinating,Unconvincing,Persuasive,Jaw-dropping,OK,Obnoxious,Inspiring25,"Im Rich Baraniuk and what Id like
to talk a little bit about today are some ideas that I think
have just tremendous resonance with all the things that have been
talked about the last two days So many different points of resonance that its going to be difficult
to bring them all up but Ill try to do my best Does anybody remember these OK so these are LP records
and theyve been replaced right Theyve been swept away
over the last two decades by these types of worldflattening
digitization technologies right And I think it was best witnessed when Thomas was playing the music
as we came in the room today Whats happened in the music world
is theres a culture or an ecosystem thats been created that if you take some words from Apple the catchphrase 
that we create rip mix and burn What I mean by that is that anyone
in the world is free and allowed to create new music and musical ideas Anyone in the world is allowed
to rip or copy musical ideas use them in innovative ways Anyone is allowed to mix them
in different types of ways draw connections between musical ideas and people can burn them or create
final products and continue the circle And what thats done
is its created like I said a vibrant community thats very inclusive with people continually working
to connect musical ideas innovate them and keep things
constantly up to date Todays hit single
is not last years hit single But Im not here
to talk about music today Im here to talk about books In particular textbooks
and the kind of educational materials that we use every day in school Has anyone here ever been to school OK does anybody realize
theres a crisis in our schools around the world Im not going to spend
too much time on that but what I want to talk about
is some of the disconnects that appear when an author
publishes a book That in fact the publishing process  just because of the fact
that its complicated its heavy books are expensive  creates a sort of a wall
between authors of books and the ultimate users of books be they teachers students
or just general readers And this is even more true
if you happen to speak a language other than one of the worlds
major languages and especially English Im going to call these people
below the barrier shutouts because theyre really
shut out of the process of being able to share
their knowledge with the world And so what I want to talk about today
is trying to take these ideas that weve seen in the musical culture and try to bring these
towards reinventing the way we think about writing books
using them and teaching from them So thats what Id like to talk about and really how we get
from where we are now to where we need to go The first thing Id like you to do
is a little thought experiment Imagine taking all the worlds books OK everybody imagine books
and imagine just tearing out the pages So liberating these pages and imagine digitizing them
and then storing them in a vast interconnected
global repository Think of it as a massive iTunes
for booktype content And then take that material
and imagine making it all open so that people can modify it
play with it improve it Imagine making it free so that anyone in the world can have
access to all of this knowledge and imagine using information technology so that you can update this content
improve it play with it on a timescale thats more
on the order of seconds instead of years Instead of editions of a book
coming out every two years imagine them coming out every  seconds So imagine we could do that
and imagine we could put people into this So that we could truly build
an ecosystem with not just authors but all the people
who could be or want to be authors in all the different
languages of the world and I think if you could do this
it would be called  Im just going to refer to it
as a knowledge ecosystem So really this is the dream and in a sense what you can think of it is were trying
to enable anyone in the world I mean anyone in the world  to be their own educational DJ creating educational materials
sharing them with the world constantly innovating on them So this is the dream In fact this dream
is actually being realized Over the last sixandahalf years weve been working really hard
at Rice University on a project called Connexions and so what Id like to do
for the rest of the talk is just tell you a little bit about what people are doing
with Connexions which you can kind of
think of as the counterpoint to Nicholas Negropontes talk yesterday where theyre working on the hardware
of bringing education to the world Were working on the opensource tools and the content So thats sort of
to put it in perspective here So create What are some of the people
that are using these kind of tools Well the first thing is theres a community
of engineering professors from Cambridge to Kyoto who are developing engineering content
in electrical engineering to develop what you can think of
as a massive super textbook that covers the entire area
of electrical engineering And not only that  it can be customized for use in each
of their own individual institutions If people like Kitty Jones a shutout  a private music teacher and mom
from Champagne Illinois who wanted to share her fantastic
music content with the world on how to teach kids how to play music  Her material is now used
over  times per month Tremendous use In fact a lot of this use coming
from United States K schools because anyone whos involved
in a school scale back the first thing thats cut
is the music curriculum And so this is just indicating
the tremendous thirst for this kind of open free content A lot of teachers are using this stuff What about ripping
What about copying reusing A team of volunteers
at the University of Texas at El Paso  graduate students translating
this engineering super textbook ideas And within about a week having this be some
of our most popular material in widespread use all over Latin America
and in particular in Mexico because of the open
extensible nature of this People volunteers and even companies that are translating materials
into Asian languages like Chinese Japanese and Thai to spread the knowledge even further OK what about people who are mixing What does mixing mean Mixing means
building customized courses means building customized books Companies like National Instruments who are embedding very powerful
interactive simulations into the materials so that we can go way beyond
our regular kind of textbook to an experience that all the teaching materials
are things you can actually interact with and play around with
and actually learn as you do Weve been working
with Teachers Without Borders who are very interested
in mixing our materials Theyre going to be using
Connexions as their platform to develop and deliver teaching materials
for teaching teachers how to teach in  countries around the world TWB is currently in Iraq training  teachers
supported by USAID And to them this idea
of being able to remix and customize to the local context
is extraordinarily important because just providing
free content to people has actually been likened
by people in the developing world to a kind of cultural imperialism  that if you dont empower people with the ability
to recontextualize the material translate it into their own language
and take ownership of it its not good OK other organizations
weve been working with UC Merced  people know about UC Merced Its a new university in California
in the Central Valley working very closely
with community colleges Theyre actually developing a lot of their science
and engineering curriculum to spread widely
around the world in our system And theyre also trying to develop
all of their software tools completely opensource Weve been working with AMD
which has a project called x which is trying to bring
Internet connectivity to  percent of the worlds
population by  Were going to be
providing content to them in a whole range of different languages And weve also been working
with a number of other organizations In particular a bunch of the projects
that are funded by Hewlett Foundation who have taken a real leadership role
in this area of open content OK burn  I think
this is sort of quite interesting Burn is the idea of trying
to create the physical instantiation of one of these courses And I think a lot of you received  I think all of you received one
of these music books in your gift pack A little present for you Just to tell you quickly about it
this is an engineering textbook Its about  pages long hardbound This costs  anybody guess How much would it cost in a bookstore Audience  dollars Richard Baraniuk
OK This costs  dollars to the student Why does it cost  dollars Because its published on demand and its developed
from this repository of open materials If this book were to be published
by a regular publisher it would cost at least  dollars So what were seeing is moving this burning
or publication process from the regular
sort of singleauthored book towards communityauthored materials that are modular that are customized
to each individual class and published on demand
very inexpensively either pushed out through Amazon or published directly
through an ondemand press like QOOP And I think that this is
an extraordinarily interesting area because there is tremendous area
under this long tail in publishing Were not talking
about the Harry Potter end right at the left side Were talking about books on hypergeometric
partial differential equations Books that might sell
 copies a year  copies a year There is tremendous
sustaining revenue under this long tail to sustain open projects like ours but also to sustain this new emergence
of ondemand publishers like QOOP who produced these two books And I think one of the things
that you should take away from this talk is that theres an impending
cutoutthemiddleman disintermediation thats going to be happening
in the publishing industry And its going to reach a crescendo
over the next few years and I think that its for our benefit
really and for the worlds benefit OK so what are the enablers Whats really making all of this happen Theres tons of technology and the only piece of technology
that I really want to talk about is XML How many people know about XML Oh great So its the future of the web right Its semantic representation of content And what you can really
think of XML in this case is its the packaging
that were putting around these pages Remember we took the book
tore the pages out Well what the XML is going to do is its going to turn those pages
into Lego blocks XML are the nubs on the Lego that allow us to combine the content
together in a myriad different ways and it provides us a framework
to share content So it lets you take this ecosystem in its primordial state
of all this content all the pages youve torn out of books and create highly sophisticated
learning machines books courses course packs It gives you the ability
to personalize the learning experience to each individual student so that every student
can have a book or a course thats customized to their
learning style their context their language and the things
that excite them It lets you reuse the same materials
in multiple different ways and surprising new ways It lets you interconnect ideas indicating how fields
relate to each other And Ill just give you my personal story We came up with this
sixandahalf years ago because I teach the stuff in the red box And my day job as Chris said 
Im an electrical engineering professor I teach signal processing and my challenge
was to show that this math  Wow about half of you
have already fallen asleep just looking at the equation But this seemingly dry math is actually the center
of this tremendously powerful web that links technology  that links really cool applications
like music synthesizers to tremendous economic opportunities but also governed
by intellectual property And the thing that I realized is there was no way
that I as an engineer could write this book
that would get all of this across We needed a community to do it and we needed new tools
to be able to interconnect these ideas And I think that really
in a sense what were trying to do is make Minskys dream come to a reality where you can imagine
all the books in a library actually starting to talk to each other And people who are teachers out here 
whoever taught you know this  its the interconnections between ideas
that teaching is really all about OK back to math Imagine  this is possible that every single equation that you
click on in one of your new etexts is something that youre going to be able
to explore and experiment with So imagine your kids
algebra textbook in seventh grade You can click on every single equation and bring up a little tool
to be able to experiment with it tinker with it understand it Because we really
dont understand until we do The same type of markup
like MathML for chemistry Imagine chemistry textbooks that actually understand the structure
of how molecules are formed Imagine Music XML that actually lets you delve
into the semantic structure of music play with it understand it Its no wonder that everybodys
getting into it right Even the three wise men OK the second big enabler
and this is where I told a big lie The second big enabler
is intellectual property Because in fact I got up here and I talked about how great
the music culture is We can share and rip mix and burn
but in fact thats all illegal And we would be accused
of piracy for doing that because this music has been propertized Its now owned
much of it by big industries So really the key thing here
is we cant let this happen We cant let this
Napster thing happen here So what we have to do
is get it right from the very beginning And what we have to do
is find an intellectual property framework that makes sharing safe
and makes it easily understandable And the inspiration here
is taken from opensource software Things like Linux and the GPL The Creative Commons licenses How many people
have heard of creative commons If you have not you must learn about it Creativecommonsorg At the bottom of every piece
of material in Connexions and in lots of other projects you can find their logo Clicking on that logo
takes you to an absolute nononsense humanreadable document a deed that tells you exactly
what you can do with this content In fact youre free to share it
to do all of these things to copy it to change it
even to make commercial use of it as long as you attribute the author Because in academic publishing
and much of educational publishing its really this idea of sharing knowledge and making impact Thats why people write
not necessarily making bucks Were not talking
about Harry Potter right Were at the long tail end here Behind that is the legal code
very carefully constructed And Creative Commons is taking off  over  million things out there licensed with a Creative Commons license Not just text but music images video And theres actually a tremendous uptake of the number of people
that are actually licensing music to make it free for people
who do this whole idea of resampling ripping mixing burning and sharing OK Id like to conclude
with just the last few points So weve built this idea of a commons People are using it We get over  unique visitors
per month just to our particular site MIT OpenCourseWare
which is another large opencontent site gets a similar number of hits But how do we protect this How do we protect it into the future And the first thing
that people are probably thinking is quality control right Because were saying that anybody
can contribute things to this commons Anybody can contribute anything So that could be a problem It didnt take long until people
started contributing materials for example on lingerie which is actually a pretty good module The only problem is its plagiarized
from a major French feminist journal and when you go
to the supposed course website it points to a lingerieselling website So this is a little bit of a problem So we clearly need some kind
of idea of quality control and this is really where the idea
of review and peer review comes in You come to TED Why do you come to TED Because Chris and his team have ensured that things are
very very high quality right And so we need to be able
to do the same thing And we need to be able
to design structures and what were doing
is designing social software to enable anyone to build
their own peer review process and we call these things lenses And basically what they allow is anyone out there can develop
their own peerreview process so that they can focus
on the content in the repository that they think is really important And you can think of TED
as a potential lens So Id just like to end by saying you can really view this
as a call to action Connexions and open content
is all about sharing knowledge All of you here are tremendously imbued
with tremendous amounts of knowledge and what Id like to do
is invite each and every one of you to contribute to this project
and other projects of its type because I think together
we can truly change the landscape of education and educational publishing So thanks very much ",0,0,0,1,0,0,0,0,0,0,0,0,0,1
26,I wrote this poem after hearing a pretty well known actress tell a very well known interviewer on television Im really getting into the Internet lately I just wish it were more organized So  If I controlled the Internet you could auction your broken heart on eBay Take the money go to Amazon buy a phonebook for a country youve never been to  call folks at random until you find someone who flirts really well in a foreign language If I were in charge of the Internet you could Mapquest your lovers mood swings Hang left at cranky right at preoccupied Uturn on silent treatment all the way back to tongue kissing and good lovin You could navigate and understand every emotional intersection Some days Im as shallow as a baking pan but I still stretch miles in all directions If I owned the Internet Napster Monster and Friendstercom would be one big website That way you could listen to cool music while you pretend to look for a job and youre really just chattin with your pals Heck if I ran the Web you could email dead people They would not email you back Laughter  but youd get an automated reply Their name in your inbox Laughter  its all you wanted anyway And a message saying Hey its me I miss you Listen youll see being dead is dandy Now you go back to raising kids and waging peace and craving candy If I designed the Internet childhoodcom would be a loop of a boy in an orchard with a ski pole for a sword trashcan lid for a shield shouting I am the emperor of oranges I am the emperor of oranges I am the emperor of oranges Now follow me OK Grandmacom would be a recipe for biscuits and spitbath instructions One two three That links with hotdiggitydogcom That is my grandfather They take you to gruffexcoponhisfourthmarriagedad He forms an attachment to kindofditzybutstillsendsgingersnapsforChristmasmom who downloads the boy in the orchard the emperor of oranges who grows up to be me  the guy who usually goes too far So if I were emperor of the Internet I guess Id still be mortal huh But at that point I would probably already have the lowest possible mortgage and the most enlarged possible penis Laughter  so I would outlaw spam on my first day in office I wouldnt need it Id be like some kind of Internet genius and me Id like to upgrade to deity and maybe just like that  pop  Id go wireless Huh Maybe Google would hire this I could zip through your servers and firewalls like a virus until the World Wide Web is as wise as wild and as organized as I think a modernday miracleoracle can get but ooheee you want to bet just how whack and unPC your Mac or PC is going to be when Im rocking hotshithotshotgodnet I guess its just like life It is not a question of if you can  its do ya We can interfere with the interface We can make Youve got Hallelujah the national anthem of cyberspace every lucky time we log on You dont say a prayer You dont write a psalm You dont chant an om You send one blessed email to whomever youre thinking of at dahdaladatdadahdaladatcom Thank you TED ,0,0,0,0,0,0,0,0,0,1,0,0,0,0
